{
  "$schema": "https://json-schema.org/draft/2020-12/schema",
  "$id": "urn:wns:digimenu:schema:cafe-config:v0",
  "$comment": "draft v0 — WO-048. Per-café configuration, used as the onboarding seed (cafes/<slug>/info.json) and as the body of a published configuration version. Not frozen: becomes schemaVersion 1 with release v0.1.0. Cross-field rules that JSON Schema cannot express (default language is enabled, every order-type channel is an enabled module that provides checkout.channel, module dependencies, the pinned release is in the window) are checked by the config validator; see docs/architecture/modules.md.",
  "title": "DigiMenu café configuration",
  "description": "Everything that makes one café different from another: identity, languages, opening hours, ordering, modules and settings, and the release it starts on. Never contains code, secrets or personal data.",
  "type": "object",
  "additionalProperties": false,
  "required": ["schemaVersion", "slug", "names", "languages", "ordering", "modules", "release"],
  "properties": {
    "$schema": {
      "type": "string",
      "description": "Optional pointer used by code editors for autocompletion."
    },
    "$comment": {
      "type": "string"
    },
    "schemaVersion": {
      "const": 0,
      "description": "Format version of this file. 0 = draft (WO-048)."
    },
    "slug": {
      "type": "string",
      "pattern": "^[a-z0-9][a-z0-9-]{0,30}[a-z0-9]$",
      "not": {
        "enum": [
          "admin",
          "api",
          "app",
          "assets",
          "health",
          "help",
          "hooks",
          "login",
          "r",
          "reset",
          "static",
          "status",
          "t",
          "verify",
          "www"
        ]
      },
      "description": "Permanent café identifier used in every printed link: /<slug>/t/<table>. Lowercase letters, digits and hyphens, 2 to 32 characters. Never changed once a card is printed. Some words are reserved for platform routes."
    },
    "status": {
      "enum": ["demo", "fixture", "onboarding", "live", "paused", "retired"],
      "default": "onboarding",
      "description": "Lifecycle state. Only 'demo' and 'fixture' may appear in the public repository."
    },
    "names": {
      "$ref": "#/$defs/localizedText",
      "description": "Café name as shown to customers. French is required; Arabic and English fall back to French."
    },
    "languages": {
      "type": "object",
      "additionalProperties": false,
      "required": ["enabled", "default"],
      "properties": {
        "enabled": {
          "type": "array",
          "items": { "$ref": "#/$defs/language" },
          "minItems": 1,
          "uniqueItems": true,
          "description": "Languages the customer can switch between."
        },
        "default": {
          "$ref": "#/$defs/language",
          "description": "Used when the phone's language is not enabled. Must be one of 'enabled' (validator rule)."
        }
      }
    },
    "menu": {
      "type": "object",
      "additionalProperties": false,
      "properties": {
        "unavailable": {
          "enum": ["grey", "hide"],
          "default": "grey",
          "description": "How sold-out items appear: greyed with a text label, or hidden."
        }
      }
    },
    "info": {
      "type": "object",
      "additionalProperties": false,
      "description": "Public café information (C-06). Business contact only: never a staff member's personal number.",
      "properties": {
        "address": { "$ref": "#/$defs/localizedText" },
        "mapUrl": { "type": "string", "format": "uri", "pattern": "^https://" },
        "phone": {
          "type": "string",
          "pattern": "^\\+[1-9][0-9]{6,14}$",
          "description": "The café's public business number in international format, e.g. +216 followed by 8 digits."
        },
        "social": {
          "type": "array",
          "items": { "type": "string", "format": "uri", "pattern": "^https://" },
          "uniqueItems": true,
          "maxItems": 6
        },
        "googleReviewUrl": {
          "type": "string",
          "format": "uri",
          "pattern": "^https://",
          "description": "Needed by the google_review module (M-14). Without it the validator warns and the module stays off."
        }
      }
    },
    "hours": {
      "type": "object",
      "additionalProperties": false,
      "description": "Opening hours in Tunis time (C-07). A day that is missing or empty means closed. A closing time earlier than the opening time means after midnight.",
      "properties": {
        "mon": { "$ref": "#/$defs/dayHours" },
        "tue": { "$ref": "#/$defs/dayHours" },
        "wed": { "$ref": "#/$defs/dayHours" },
        "thu": { "$ref": "#/$defs/dayHours" },
        "fri": { "$ref": "#/$defs/dayHours" },
        "sat": { "$ref": "#/$defs/dayHours" },
        "sun": { "$ref": "#/$defs/dayHours" }
      }
    },
    "branding": {
      "type": "object",
      "additionalProperties": false,
      "properties": {
        "primaryColor": {
          "type": "string",
          "pattern": "^#[0-9a-fA-F]{6}$",
          "description": "Accent colour. The core checks text contrast (WCAG 2.1 AA) before publishing."
        },
        "logo": {
          "type": "string",
          "pattern": "^(?!/)(?!.*\\.\\.)[A-Za-z0-9_./-]+\\.(svg|png|webp)$",
          "description": "Path of the logo inside the café's media folder."
        }
      }
    },
    "ordering": {
      "type": "object",
      "additionalProperties": false,
      "required": ["types"],
      "description": "Which order types the café accepts and through which channel. An empty 'types' object means menu and show-to-waiter only.",
      "properties": {
        "types": {
          "type": "object",
          "additionalProperties": false,
          "properties": {
            "dine_in": {
              "type": "object",
              "additionalProperties": false,
              "required": ["channel"],
              "properties": {
                "channel": { "$ref": "#/$defs/moduleKey" }
              }
            },
            "takeaway": {
              "type": "object",
              "additionalProperties": false,
              "required": ["channel"],
              "properties": {
                "channel": { "$ref": "#/$defs/moduleKey" },
                "prepMinutes": {
                  "type": "integer",
                  "minimum": 0,
                  "maximum": 1440,
                  "default": 15,
                  "description": "Earliest pickup slot = now + prepMinutes, within opening hours."
                }
              }
            },
            "delivery": {
              "type": "object",
              "additionalProperties": false,
              "required": ["channel"],
              "properties": {
                "channel": { "$ref": "#/$defs/moduleKey" },
                "areaNote": {
                  "$ref": "#/$defs/localizedText",
                  "description": "Fixed note on delivery area and fee. No zone pricing."
                }
              }
            }
          }
        },
        "dineInDetails": {
          "enum": ["required", "optional"],
          "default": "required",
          "description": "Whether first name and phone are required for dine-in orders (C-15, D-027)."
        },
        "maxQtyPerLine": {
          "type": "integer",
          "minimum": 1,
          "maximum": 99,
          "default": 20
        },
        "maxOrderTotal": {
          "$ref": "#/$defs/millimes",
          "description": "Largest order total accepted, in millimes (300000 = 300,000 DT)."
        }
      }
    },
    "modules": {
      "type": "object",
      "description": "Module switches and settings, keyed by module key. A module that is not listed is off. Settings are checked against the module's own settings schema by the validator.",
      "propertyNames": { "$ref": "#/$defs/moduleKey" },
      "additionalProperties": {
        "type": "object",
        "additionalProperties": false,
        "required": ["enabled"],
        "properties": {
          "enabled": { "type": "boolean" },
          "settingsVersion": { "type": "integer", "minimum": 1 },
          "settings": { "type": "object" }
        }
      }
    },
    "release": {
      "type": "object",
      "additionalProperties": false,
      "required": ["pinned"],
      "description": "Release the café starts on. After onboarding the live pin is data in the database and changes only through the pin action (docs/architecture/releases.md).",
      "properties": {
        "pinned": { "$ref": "#/$defs/semver" }
      }
    }
  },
  "$defs": {
    "language": {
      "enum": ["fr", "ar", "en"]
    },
    "localizedText": {
      "type": "object",
      "additionalProperties": false,
      "required": ["fr"],
      "properties": {
        "fr": { "type": "string", "minLength": 1, "maxLength": 200 },
        "ar": { "type": "string", "minLength": 1, "maxLength": 200 },
        "en": { "type": "string", "minLength": 1, "maxLength": 200 }
      }
    },
    "moduleKey": {
      "type": "string",
      "pattern": "^[a-z][a-z0-9_]{1,31}$"
    },
    "semver": {
      "type": "string",
      "pattern": "^(0|[1-9][0-9]*)\\.(0|[1-9][0-9]*)\\.(0|[1-9][0-9]*)(-[0-9A-Za-z.-]+)?$"
    },
    "millimes": {
      "type": "integer",
      "minimum": 1,
      "description": "Money as whole millimes: 4500 means 4,500 DT."
    },
    "dayHours": {
      "type": "array",
      "maxItems": 3,
      "items": {
        "type": "array",
        "prefixItems": [{ "$ref": "#/$defs/clockTime" }, { "$ref": "#/$defs/clockTime" }],
        "items": false,
        "minItems": 2,
        "description": "[opening time, closing time]"
      }
    },
    "clockTime": {
      "type": "string",
      "pattern": "^([01][0-9]|2[0-3]):[0-5][0-9]$"
    }
  }
}
